url,title,descr,"Юлия Тимошенко пообещала в случае победы на выборах вернуть жителям страны вклады, потерянные после распада СССР",Данное заявление лидер партии «Батькивщина» сделала во время выступления перед потенциальными избирателями
,Следователи начали проверку инцидента с пассажирским самолетом в Пулково,Он выкатился за пределы взлетно-посадочной полосы
,"Задержанному в Греции россиянину Евгению Калинину, грозит смертельная опасность в случае экстрадиции на Украину","По крайней мере, так утверждает его адвокат Яннис Рахиотис"
,«Барселона» на выезде победила «Реал» в центральном матче 26-го тура чемпионата Испании,Встреча в Мадриде завершилась со счетом 1:0 в пользу гостей
,Число пострадавших в результате протестов в Алжире возросло до 183 человек,Об этом сообщает агентство APS со ссылкой на министерство здравоохранения
,Минобороны России обвинило США в препятствовании вывоза сирийских беженцев,"Американские военные отказались пропустить транспортные колонны, отправленные в лагерь «Эр-Рукбан»"
,Суд Кисловодска арестовал Александра Емельяненко на 10 суток по административной статье о неповиновении полиции,"37-летний боец смешанных единоборств признался, что действительно находился за рулем в нетрезвом состоянии и нагрубил полицейским"
,Основателю британского фонда Hermitage Capital Уильяму Браудеру в России предъявлено новое обвинение,На этот раз в убийстве российского бизнесмена Александра Перепеличного в 2012 году
