url,title,descr
,Речное судно загорелось на юге Москвы,К месту происшествия отправили 25 пожарных расчетов и пожарно-спасательное судно МЧС…
,Новейший американский космический корабль Крю Дрэгон начал сближение с МКС,Через полчаса он должен пристыковаться к Международной космической станции…
,"Матвиенко: Москва сделает всё возможное, чтобы не допустить военного вторжения в Венесуэлу",Это пообещала спикер Совета Федерации…
,Тремя матчами завершается 18 тур чемпионата России по футболу,"В первом круге Спартак обыграл краснодарцев на их поле, при том, что хозяева выглядели лучшие и эксперты сочли, что красно-белым повезло…"
,Телеканал 'Москва-24' сообщил о начале сноса главной арены спорткомплекса 'Олимпийский',"Заявления о сносе спорткомплекса преждевременны, — убедился наш корреспондент…"
,Задержанные участники акции в поддержку аспиранта МГУ Азата Мифтахова до сих пор остаются в полиции,Об этом «Эху» рассказала их адвокат Мария Эйсмонт…
,"'360': Полицейским, задержавшим бойца смешанных единоборств Александра Емельяненко, пригрозили увольнением","По данным телеканала, силовиков просили закрыть глаза на происходящее и не трогать Емельяненко, когда выяснилось, что в Кисловодске он управляет автомобилем в нетрезвом состоянии…"
,"Сын британки Дон Стерджес, отравленной в Эймсбери, попросил Владимира Путина посодействовать в расследовании ее гибели",Он направил российскому президенту письмо с просьбой выдать спецслужбам двух подозреваемых по этому делу…
,В столице начали сносить главную арену спорткомплекса 'Олимпийский',"По плану городских властей, на реконструкцию спортивного комплекса уйдет два года…"
,Митинги против 'мусорной реформы' приши в городах Урала,"На согласованные акции вышли жители Екатеринбурга, Ивделя, Асбеста, Тюмени…"
,Дональд Трамп потребовал от Ким Чен Ына закрыть секретный завод по обогащению урана,Американский лидер обратился к северокорейскому коллеге во время недавней встречи в Ханое…
,"Матвиенко: Россия сделает все возможное, чтобы предотвратить военное вторжение США в Венесуэлу",Матвиенко встретилась в Москве с исполнительным вице-президентом Венесуэлы Делси Родригес…
,СКР предъявил Браудеру обвинения в убийстве бизнесмена и информатора по 'делу Магнитского' Александра Перепеличного,Об этом Браудер сообщил в Твиттере…
,"Сын жительницы Великобритании, погибшей от отравления 'Новичком', попросил Путина допросить Боширова и Петрова",20-летний Эван Хоуп написал президенту письмо…
,В столичном районе Зюзино состоится митинг против закрытия роддома 10,Об этом рассказал в эфире радиостанции «Эхо Москвы» муниципальный депутат района Зюзино Константин Янкасукас…
,Жители польского Гданьска сегодня выбирают нового мэра,"Досрочные выборы были назначены после убийства Павла Адамовича, который занимал пост градоначальника больше двадцати лет…"
,В Эстонии сегодня парламентские выборы,"По итогам, планируется избрать больше ста депутатов…"
,Задержанные на акции в поддержку аспирата МГУ Азата Мифтахова до сих пор остаются в полиции,Об этом «Эху» рассказала адвокат участников мероприятия Мария Эйсмонт…
,"В городе Бердск силовики штурмом взяли здание МВД, чтобы задержать замначальника местного отдела полиции",Алексея Зорина и еще одного сотрудника заподозрили в мошенничестве…
,Около 40 автомобилей этим утром попали в аварии на МКАД,Причиной ДТП стал гололед…
,Аномальное потепление идет в Москву,В предстоящий вторник температура будет на пять градусов выше нормы…
,"Трамп объявил, что террористическая организация 'Исламское государство' понесет полное поражение в ближайшие пару дней","Это уже не первый раз на этой неделе, когда Трамп объявляет о скорой победе…"
,Уильяму Браудеру предъявили обвинения в убийстве российского бизнесмена Александра Перепеличного,Об этом сам Браудер сообщил в Твиттере…
,"Телеканал '360': Кисловодским полицейским, задержавшим бойца Александра Емельяненко, может грозить увольнение","По сведениям канала, полицейским был дан приказ не трогать Емельяненко и закрыть на происходящее глаза…"
,"Сын жительницы Великобритании, скончавшейся от отравления ядом 'Новичок', написал письмо президенту России",20-летний Эван Хоуп попросил Владимира Путина позволить британским спецслужбам допросить подозреваемых в организации отравлении в Солсбери…
,В «Роскосмосе» планируют поставить видеокамеры на месте заправки ракет «Союз»,"Вопросом озаботились после недавнего случая, когда перед стартом в топливном баке ракеты из-за недолива закончился окислитель…"
,В Москве сносят спорткомплекс «Олимпийский»,"По плану властей, полная реконструкция займет два года…"
,В районе Рублевского шоссе столкнулись около 40 машин,Сразу две крупные аварии на МКАДе…
,"В Черногории тысячи людей вышли на митинг, требуя отставки президента страны Мило Джукановича и правительства","Жители балканской республики обвиняют власти в коррупции, кумовстве и злоупотреблении служебным положением…"
,Причиной досрочного прекращения саммита США и КНДР стало требование Трампа закрыть секретный завод по обогащению урана,"Президент США рассказал, что секретный объект вычислила разведка…"
,В Греции по запросу Украины задержали гражданина России,Это специалист в области энергетики Евгений Калинин…
,"Погодные условия стали причиной авиаинцидента в аэропорту Петербурга, заявили в компании 'Узбекские авиалинии'","Там подчеркнули, что воздушное судно не получило повреждений…"
,На МКАДе в условиях гололёда столкнулись около 40 автомобилей,ДТП произошло на 59-м километре…
,В аэропорту Кемерово накануне эвакуировали самолет из-за угрозы взрыва,"В полиции сообщили, что была обнаружена бесхозная сумка…"
,В Кисловодске арестовали бойца Александра Емельяненко,Он взят под стражу на десять суток…
,Российские власти обвинили основателя фонда Hermitage Capital в убийстве,"По версии следствия, Уильям Браудер причастен к смерти бизнесмена Александра Перепеличного…"
,Сын отравленной близ Солсбери англичанки обратился к Путину с просьбой выдать подозреваемых в убийстве матери,"Сын погибшей женщины жалуется, что не получает поддержки от британских властей, но стремится к справедливости в расследовании гибели матери…"
,В Петербурге самолет при посадке выкатился за пределы полосы,Полиция проводит проверку…
,Столичным водителям посоветовали пересесть на общественный транспорт из-за снегопада в Москве,"Чиновники предупреждают, что осадки сохранятся в течение дня…"
,Несколько тысяч человек вышли на антипрезидентский марш в Черногории,Акция прошла в Подгорице…
,Основателю британского фонда Эрмитедж Кэпитал Уильяму Браудеру предъявили обвинения в убийстве российского бизнесмена,Он назвал обвинения абсурдными…
,"Сын жительницы Великобритании, погибшей в результате отравления 'Новичком', написал письмо Владимиру Путину","Эван Хоуп сообщил, что надеется добиться справедливости с помощью российского президента…"
,Принадлежащая Би-би-си радиостанция Radio 2 байкотирует песни Майкла Джексона из-за новых обвинений в педофилии,Композиции певца «тихо исчезли» из эфира перед выходом документального фильма «Покидая Неверленд» о сексуальном насилии в отношении детей…
,В Гданьске сегодня пройдут выборы главы города,Досрочное голосование было объявлено после трагической смерти в середине января мэра этого города Павла Адамовича…
,В московском Зюзине пройдет митинг за сохранение роддома №10,"Это единственный центр планирования семьи на несколько районов, но власти хотят его закрыть…"
,Основателю британского фонда Hermitage Capital Уильяму Браудеру в России предъявлено новое обвинение,На этот раз в убийстве российского бизнесмена Александра Перепеличного в 2012 году….
,Путин встретится сегодня с российскими спортсменами и познакомится с инфраструктурой Всемирной зимней универсиады,"Также он посетит одно из соревнований, сообщает пресс-служба Кремля…"
,США и Южная Корея договорились прекратить две серии регулярных военных учений,Об этом сообщил Пентагон…
,Около 60 человек собрались накануне на народный сход у главного здания МГУ,"Они пришли поддержать аспиранта Азата Мифтахова, арестованного по делу о поджоге офиса «Единой России»..."
,Знакомый бывшего министра финансов ДНР Александра Тимофеева опроверг его задержание,"Ранее портал DonDay сообщил, что экс-министра самопровозглашенной республики задержали в Ростове-на-Дону и доставили в Москву…"
,В Эстонии сегодня пройдут парламентские выборы,В выборах участвует 10 партий…
,Глава российского МИДа Сергей Лавров сегодня отправится в ближневосточное турне,"Он проведет переговоры в Катаре, Саудовской Аравии, Кувейте и Объединенных Арабских Эмиратах…"
,"Сын британки Дон Стерджес, скончавшейся в прошлом году после отравления в Эймсбери, написал письмо Владимиру Путину",Он просит российского президента передать британским спецслужбам двух подозреваемых по данному делу…
,Митинги против мусорной реформы пройдут в нескольких регионах России,"В частности, запланированы акции в городах Свердловской области…"
,Зимняя универсиада стартовала в Красноярске,"Это значительное мероприятие, и стоит многого ожидать от российской команды, — сказал «Эху» спортивный обозреватель издания «Аргументы и факты» Александр Боярский…"
,Шестнадцатая волна протестов 'Желтых жилетов' во Франции впервые с их начала собрала менее 40 тысяч участников,Такие сведения сообщили в министерстве внутренних дел страны…
,В Эстонии пройдут парламентские выборы. Избирательные участки будут открыты с 9 до 20 часов,Предварительные итоги ожидаются через несколько часов после их закрытия…
,"На аукционе во Франции сегодня с молотка продадут фотографии Юрия Гагарина, сделанные за три дня до его гибели","Снимки, автограф и перьевая ручка первого в мире космонавта выставлены на торги аукционного дома Cazo…"
,В Пскове пройдет митинг против строительства химзавода в районе Моглино,"Акция называется «За чистоту окружающей среды, свободу слова и достойную жизнь»..."
,В городе Златоусте Челябинской области прошел митинг против строительства кремниевого завода,Предприятие станет катастрофой для экологии региона…
,Около 60 человек собрались накануне на народный сход у главного здания МГУ,"Они пришли поддержать аспиранта Азата Мифтахова, арестованного по делу о поджоге офиса «Единой России»..."
,Глава бразильской корпорации Vale Фабио Шварцман ушел во временную отставку после прорыва дамбы,"Жертвами аварии стали более 180 человек, еще свыше 120 числятся пропавшими без вести…"
,Суд Кисловодска арестовал 10 суток Александра Емельяненко за неповиновение полиции,"Бойца смешанных единоборств задержали 1 марта, когда он неправильно припарковался, а затем попытался скрыться от сотрудников ДПС и эвакуатора…"
,Сегодня в австрийском Зеефельде завершается чемпионат мира по лыжным видам спорта,В этот день состоится одна из самых интересных гонок – мужской марафон…
,В Сахаровском центре в Москве сегодня состоится благотворительный вечер,Пожертвования будут собирать для помощи политзаключенным…
,Основателю британского фонда Hermitage Capital Уильяму Браудеру в России предъявлено новое обвинение,На этот раз в убийстве российского бизнесмена Александра Перепеличного в 2012 году…
,Накануне около метро Автозаводская около сотни человек протестовали против применения реагентов,Организаторами акции выступили движение «Моссовет» и «Левый фронт»...
,В Москве прошла акция с требованием прекратить уголовное преследование фигурантов дела «Новое величие»,Несколько десятков человек собрались возле станции метро Третьяковская…
,"В Москве этим утром ожидается снегопад, местами метель и усиления ветра",Синоптики объявили «желтый» уровень погодной опасности
,На Сокольнической линии Московского метро сегодня будут закрыты две станции «Румянцево» и «Саларьево»,Это связано с вводом в эксплуатацию нового участка красной ветки
,'Барселона' в гостях обыграла 'Реал' со счетом 1:0 в матче 26-го тура чемпионата Испании,Встреча первого круга текущего сезона завершилась со счетом 5:1 в пользу каталонского клуба
,Принадлежащая Би-би-си радиостанция Radio 2 байкотирует песни Майкла Джексона из-за новых обвинений в педофилии,Композиции певца «тихо исчезли» из эфира перед телепремьерой документального фильма «Покидая Неверленд»
,Лидер венесуэльской оппозиции Хуан Гуайдо объявил о намерении вернуться в Венесуэлу,Он также собирается объявить о новых манифестациях против действующего президента Николаса Мадуро
,В Ростове-на-Дону задержан бывший министр финансов ДНР Александр Тимофеев,Его доставили в Москву
,В столице Черногории Подгорице состоялся многотысячный протестный марш,Демонстранты требовали отставки президента страны Мило Джуканович и его правительства
,США и Южная Корея договорились прекратить две серии регулярных военных учений,"Решение принято на фоне саммита США-КНДР, который прошел на этой неделе в Ханое"
,Место заправки ракет 'Союз' на Байконуре оборудуют камерами видеонаблюдения,"Решение принято после недавнего инцидента, когда в третьей ступени ракеты преждевременно закончился окислитель из-за недолива"
,Суд Кисловодска арестовал 10 суток Александра Емельяненко за неповиновение полиции,"На заседании он признался, что был пьян и извинился перед сотрудниками полиции"
,США и Южная Корея прекращают совместные военные учения,Цель — ускорение процесса денуклеаризации Корейского полуострова
,SANA со ссылкой на источники сообщает о применении белого фосфора при авиаударе в провинции Дейр-аз-Зор,"По данным сирийского агентства, запрещенные бомбы использовала международная коалиция во главе с США"
,В городе Усолье-Сибирское Иркутской области нашли мертвой адвоката Галину Музыку,"Она перестала выходить на связь вскоре после разговора с местным жителем, который сообщил об избиениях в отделе полиции"
,В Ростове-на-Дону задержан бывший министр финансов ДНР Александр Тимофеев,Его подозревают в рейдерском захвате агропромышленного предприятия в 2017 году
,Зонду NASA Mars InSight впервые удалось пробурить грунт на Марсе,Об этом говорится в сообщении на сайте Германского центра авиации и космонавтики
,В Париже в ходе протестов «желтых жилетов» задержали 33 человека,"По данным МВД, в акции участвовало 4 тысячи человек"
